{
  "artifact_bindings": {
    "artifact_binding_root": "9c2a3adcd5954bf57ed30ad837622d2b826d41457459dd889511a58ad034f3d1",
    "artifact_count": 10,
    "bindings": [
      {
        "artifact_binding_hash": "d149ceec92783ab9e64ffcdf670a2a807e2832915c42d6acf19821198d555d3b",
        "declared_hash": "02f3172634a1ec03a81c458b57250114c53b1a58056a5b4710f1c63b4e768599",
        "hash_reproducible": true,
        "name": "universal_citation_verification_contract",
        "payload_hash": "ccd503298ca5f44653c61f69f33c2ddae7925bc732ea3303317d5f11a126c941",
        "present": true,
        "status": "ready",
        "target_level": "RDLLM-L141",
        "version": "rdllm-universal-citation-verification-contract/v1"
      },
      {
        "artifact_binding_hash": "0849babae89bc131e4e088abf7264f64032c35df8ebf004d0707823dfe671a2a",
        "declared_hash": "b2ccf908f7a6a9846bbe5268025ec6f2d585d8d9e0ec27f8256b4f24c23731be",
        "hash_reproducible": true,
        "name": "response_envelope",
        "payload_hash": "50ed97d811e60b08febfb00cd3b751d4a3fc89951df8837c8b25f19cd98e3460",
        "present": true,
        "status": "verified",
        "target_level": "",
        "version": "rdllm-response-envelope/v1"
      },
      {
        "artifact_binding_hash": "9b6da4576931b6773ec3cecc0d37f3a5dc2dd72576acd0dabf16a56e10091d58",
        "declared_hash": "90982909ee231837884a1fd90cb805ba23e8bdeda74d3209feb3c8875a2c5737",
        "hash_reproducible": true,
        "name": "source_footer_delivery",
        "payload_hash": "fc37fa57d1222e209fb68925041a40ff67db7cb02397acb63fc43fe1924c6929",
        "present": true,
        "status": "ready",
        "target_level": "RDLLM-L103",
        "version": ""
      },
      {
        "artifact_binding_hash": "81e85a2ebe661fac14429e2e7a3cb62acde65dc8064cfca87e23ea3d5f6d1e73",
        "declared_hash": "787f349109f3980a6519e68f78f9169a558a76ad2f7bb400e21467eddc1bcd80",
        "hash_reproducible": true,
        "name": "answer_claim_coverage_report",
        "payload_hash": "aecff2b610fa4e6f505fb9e6e9c510cf076d3c29480e8a1dcb6de017bda1fed4",
        "present": true,
        "status": "verified",
        "target_level": "RDLLM-L59",
        "version": "rdllm-answer-claim-coverage-report/v1"
      },
      {
        "artifact_binding_hash": "680ffd87d9f226dd547b8f680bda6eafae6b5610641e6067496a92f574359193",
        "declared_hash": "252e757a16d2c5711e88bf72fa4a8f93935efcb1b03ab6b663ebb2f0f3143a74",
        "hash_reproducible": true,
        "name": "source_freshness_audit",
        "payload_hash": "0a0900f4f056821c88555d33724c26e0591beed41ab23fc2a8ded2d14f2f2ba8",
        "present": true,
        "status": "ready",
        "target_level": "RDLLM-L116",
        "version": "rdllm-source-freshness-audit/v1"
      },
      {
        "artifact_binding_hash": "7e4e33da882bdb594a08447684b606240befb5f0066002b880d5ff3e206b4d88",
        "declared_hash": "2dc921de0254159898bce7a3af140bd9e468ee442b00648f5b6bd1b67e43dfc5",
        "hash_reproducible": true,
        "name": "consent_revocation_propagation",
        "payload_hash": "e1eb7dd02f40278bfa12405f40f765bf44c3a9bd9ee12f935ee4c178386c7707",
        "present": true,
        "status": "ready",
        "target_level": "RDLLM-L118",
        "version": "rdllm-consent-revocation-propagation/v1"
      },
      {
        "artifact_binding_hash": "8d1d9708f4509fcd8e710f7491e03f59fbf3c4886623ca8531f32fba3d35da3d",
        "declared_hash": "cbb0d24666577043fa9031de5ae7d022bde442aef432b4020f4f628547a61743",
        "hash_reproducible": true,
        "name": "citation_url_health",
        "payload_hash": "6065c9898e37b695872e3385f002817f5a351df0839a54ec0cc2191ed6246dc3",
        "present": true,
        "status": "ready",
        "target_level": "RDLLM-L124",
        "version": "rdllm-citation-url-health/v1"
      },
      {
        "artifact_binding_hash": "666ebc0e55e549d6cea485913ccf32baed113c98860dfff1d561310546c297db",
        "declared_hash": "000a11d94c0590dd12c403912bb1eb1e9569fd73182a6cb90170abb6a6970ece",
        "hash_reproducible": true,
        "name": "evidence_locator_manifest",
        "payload_hash": "0ce20056cd21b754f45033910d69c154dec761f45633e52d85ac7fca6c5e526d",
        "present": true,
        "status": "ready",
        "target_level": "RDLLM-L123",
        "version": "rdllm-evidence-locator-manifest/v1"
      },
      {
        "artifact_binding_hash": "f8afa6a807b47b04232a14e4a1f556bd0b816cd8d0b4d361c918be7f47240adb",
        "declared_hash": "c02d150676e3f650854bf21ab6acc4460507e90680cadcdba1c1ae72144414e9",
        "hash_reproducible": true,
        "name": "source_access_lease_report",
        "payload_hash": "fc33ec0e066082db282b7ed473359ade2a75ef16b9184551e14fe30f4b0d6ec0",
        "present": true,
        "status": "ready",
        "target_level": "RDLLM-L98",
        "version": ""
      },
      {
        "artifact_binding_hash": "aae2b44de93e3299f8fb050866ab57fca150d5c93dd59e5798aba8825494bc6e",
        "declared_hash": "ca4bf6639b80b98dd0dffcf7b67855a0a9717e22ceca6576df57e0c029346974",
        "hash_reproducible": true,
        "name": "trust_registry",
        "payload_hash": "13b69e349e4e0d309d4ee9af06382b4f8e0a1328d39b33bbfd0d5ab66cb65fc0",
        "present": true,
        "status": "ready",
        "target_level": "RDLLM-L51",
        "version": "rdllm-trust-registry/v1"
      }
    ]
  },
  "checks": {
    "artifact_hashes_reproducible": true,
    "cache_collision_resistance_enforced": true,
    "citation_contract_ready_l141": true,
    "discovery_manifest_exposes_contract_path": true,
    "failure_cases_fail_closed": true,
    "freshness_consent_and_license_preserved": true,
    "private_strings_absent": true,
    "provider_family_coverage_complete": true,
    "public_report_has_no_private_field_names": true,
    "public_verifier_commands_declared": true,
    "required_core_artifacts_present": true,
    "reuse_decisions_present": true,
    "reuse_decisions_ready": true,
    "reuse_dimensions_complete": true,
    "reuse_metered_as_new_usage": true,
    "reuse_source_labels_covered_by_l141": true
  },
  "commitments": {
    "artifact_binding_root": "9c2a3adcd5954bf57ed30ad837622d2b826d41457459dd889511a58ad034f3d1",
    "failure_case_root": "91ff8eec03059fd8da7ace62938a556e32312e6eb9282880467a8ca40025b9b5",
    "grounded_reuse_commitment_hash": "f8b270da53bee4c2aa0b09f046826561903d44e4f6954fe3de5088cfc6d5149d",
    "provider_family_root": "35996f3a82b66309334717f409214a4cd39d7d340f8c8d930f1f58361e688d1c",
    "reuse_decision_root": "e327001c0396ecd5b5affc7f3af5bc4ec2798d791658d9db5378aed9eddafa31",
    "reuse_dimension_root": "c32604bf487ef157bcee0eba6d7024ece3691cdea9e6643c2eb579d897eb2853",
    "universal_citation_verification_contract_hash": "02f3172634a1ec03a81c458b57250114c53b1a58056a5b4710f1c63b4e768599",
    "verifier_command_root": "4c43195f154526af9d2560c722788f5f697753738fbe02a48445c287edc3b5eb"
  },
  "created_at": "2026-06-02T01:10:19Z",
  "failure_case_rows": [
    {
      "case_id": "cache_poisoning",
      "expected_block": true,
      "failure_case_row_hash": "e18ed2cad205abc13793891f73050e1f326c0d0891ccde59f6416f90f6602b00",
      "fixture_hash": "8e90c3c281b0563b4da68e5a4c166e3e03abda9f9a53496fd4da5d34d0b0430a",
      "observed_block": true,
      "passed": true,
      "required": true,
      "verifier_command": "verify-universal-grounded-reuse-contract"
    },
    {
      "case_id": "citation_contract_drift",
      "expected_block": true,
      "failure_case_row_hash": "73918a1e9fec44ed828b3848c8a14123296cc6a98d0cb7213401e8fd3f778d6f",
      "fixture_hash": "49c76a0a37a28329cdca4245bd929c1042a10a6570de020d7841b9d80be12612",
      "observed_block": true,
      "passed": true,
      "required": true,
      "verifier_command": "verify-universal-grounded-reuse-contract"
    },
    {
      "case_id": "evidence_mismatch",
      "expected_block": true,
      "failure_case_row_hash": "367a7a9df13d4913a05471df8600fbb460113d7344cdd1f69554e2e026620554",
      "fixture_hash": "f13aa6f214bcb3cdfca1f5e0e29b39a3b19238653ff284909674b43a05560d69",
      "observed_block": true,
      "passed": true,
      "required": true,
      "verifier_command": "verify-universal-grounded-reuse-contract"
    },
    {
      "case_id": "missing_reuse_royalty_event",
      "expected_block": true,
      "failure_case_row_hash": "a9f07eca621ee61c008f66fd3382f34c0e732c23b433484b4fac8da88a3fb192",
      "fixture_hash": "46d28698759b9780ae74477a22cbca5d6c80752844f8488cbe5d15a0ef169fe8",
      "observed_block": true,
      "passed": true,
      "required": true,
      "verifier_command": "verify-universal-grounded-reuse-contract"
    },
    {
      "case_id": "private_cache_key_leak",
      "expected_block": true,
      "failure_case_row_hash": "c51035987cd9ccda5c237049e5179569798079582b795cd1acc3bebbf26387c5",
      "fixture_hash": "161259b10cf9719160291f6af46becaa0b6b51740bf096431df87964663ebb16",
      "observed_block": true,
      "passed": true,
      "required": true,
      "verifier_command": "verify-universal-grounded-reuse-contract"
    },
    {
      "case_id": "query_collision",
      "expected_block": true,
      "failure_case_row_hash": "7be16ca34aa3498b6b91bee0b4e505d4fcf27e866681993dc59509deeff001bd",
      "fixture_hash": "1ae71544c565fa73fc2679034fc010d37cd3dc1a15aa6f2275ce540d63bede40",
      "observed_block": true,
      "passed": true,
      "required": true,
      "verifier_command": "verify-universal-grounded-reuse-contract"
    },
    {
      "case_id": "revoked_consent",
      "expected_block": true,
      "failure_case_row_hash": "eb14ef72156bfa59329fac8f92851c4f4b94ba785c278a33b8e32cb6fa7c06a8",
      "fixture_hash": "d1de8b50a5076a627380421815618a594dc4e211d1dd3ee3130493ad2d62eb95",
      "observed_block": true,
      "passed": true,
      "required": true,
      "verifier_command": "verify-universal-grounded-reuse-contract"
    },
    {
      "case_id": "stale_source_version",
      "expected_block": true,